{
  "schema_version": "signal-space-plan-v1",
  "experiment_id": "gross.clock-longevity.v1",
  "model_id": "signal-space.ss-ocf-1.flat-clock.v1",
  "question": "Does the frozen radial Test 6 clock pass the longevity prerequisite before Test 7?",
  "source_equations": [
    "research/papers/gross-operator-program-v0.2.md sections 7-9,15.6-15.7",
    "docs/research/gross-test-06-results.md",
    "docs/research/gross-test-06-prerequisites.md"
  ],
  "runtime_config": "fixtures/research/gross-test-06-longevity.json",
  "runtime_config_sha256": "df947584127204a63fbf51550b910a84eaf15aaa4709d07918e0bd3fbd1c2d5d",
  "method": {
    "action": "SS OCF 1 flat action, U=s-s²+s³, V=0.25-0.4s+0.2s², zeta=0.1. Neutral response extension Z=1+0.2s (M0=m=1); same underlying action, separate registered active-neutral sector.",
    "units": "c=hbar=m=1; r,t in m^-1; fields in m; frequencies in m; dimensionless tick shift Omega*delta_t/(2*pi).",
    "domain": "Saved omega_Q=0.900 profiles; R=80,h=0.1 and h=0.05. Response R=160 independently. Fixed readout r=0.1.",
    "boundaries": "Regular origin and zero radial fields at finite R. Longevity uses original logged sponge beyond r=60. Response uses no sponge; earliest outer reflection cannot reach core by t=100.",
    "initial_data": "Exact saved discrete profiles/eigenmodes; chi=0.001 f/max(f/r), chi momentum=0, Phi momentum=-i*0.9*Phi. Response ra=A*c*cos^4(pi*(r-c)/(2*w)) inside |r-c|<w, zero outside; (c,w)=(18,3) incoming, optional (4,2) outgoing. Initial d_t(ra)=+d_r(ra) incoming and negative outgoing; p_a=Z*d_t(ra). Amplitude A is the coefficient of this prescribed radial packet; it is not an exact peak a normalization.",
    "solver": "Longevity reuses registered kick-drift-kick at dt=.04,.02; all 100 nominal periods, sample every .2. Response uses RK4 of discrete reciprocal Hamiltonian at dt=.02, mesh/time .01; samples .1; t=100. First solve exact Taylor coefficients a1,deltaPhi2,deltaChi2 on evolving no-pulse baseline; save all predictions before full nonlinear runs. No parameter fit. Neutral stiffness G^T Z_faces G, G b=r_face*d_r(b/r).",
    "tolerances": "Locked criteria below. L2 means Euclidean norm of uniformly sampled local traces over t=0..100. Numerical error is direct coarse/fine difference, no assumed Richardson order. Deterministic error floor 0.2% for response approximation; unresolved if signal RMS <=1e-12. Resource ceiling 1800 s wall, 1024 MiB, 100 MiB output."
  },
  "hypotheses": [
    {
      "id": "usable",
      "prediction": "The frozen calibration survives full refined longevity and predicts an even, amplitude-squared local response within registered error controls."
    },
    {
      "id": "inadequate",
      "prediction": "Unstable clock, sign-odd response, persistent prediction residual or ambiguous local ticks invalidates the tested approximation."
    }
  ],
  "controls": [
    {
      "id": "frozen",
      "purpose": "exclude branch or calibration retuning",
      "method": "verify saved profile/mode hashes; same physical local radius r=0.1 on every grid"
    },
    {
      "id": "numerics",
      "purpose": "distinguish physical response from discretization and boundaries",
      "method": "independent h/2 at R=80, dt/2 at h=0.1; response additionally R=160; no change to input physical profile branch"
    }
  ],
  "criteria": [
    {
      "id": "frozen-inputs",
      "observable": "frozen-inputs",
      "pass_if": "All input SHA-256 values match the frozen Test 6 profiles and modes.",
      "fail_if": "Finite, resolved data violates the preregistered inequality.",
      "unresolved_if": "Missing, nonfinite or under-resolved signal/marker or required control.",
      "uncertainty": "Direct independent mesh, time, box differences; finite sampling; no statistical confidence claim."
    },
    {
      "id": "local-record",
      "observable": "local-record",
      "pass_if": "Each 100-period trace has at least 99 positive-going crossings and frequency within 2% of frozen Omega.",
      "fail_if": "Finite, resolved data violates the preregistered inequality.",
      "unresolved_if": "Missing, nonfinite or under-resolved signal/marker or required control.",
      "uncertainty": "Direct independent mesh, time, box differences; finite sampling; no statistical confidence claim."
    },
    {
      "id": "lifetime",
      "observable": "lifetime",
      "pass_if": "Absolute final projected mode-energy change <1% on base, h/2 and dt/2 over 100 nominal periods.",
      "fail_if": "Finite, resolved data violates the preregistered inequality.",
      "unresolved_if": "Missing, nonfinite or under-resolved signal/marker or required control.",
      "uncertainty": "Direct independent mesh, time, box differences; finite sampling; no statistical confidence claim."
    },
    {
      "id": "convergence",
      "observable": "convergence",
      "pass_if": "Local frequencies differ by <1%; absolute final mode-energy fractions differ by <0.01 on mesh/time controls.",
      "fail_if": "Finite, resolved data violates the preregistered inequality.",
      "unresolved_if": "Missing, nonfinite or under-resolved signal/marker or required control.",
      "uncertainty": "Direct independent mesh, time, box differences; finite sampling; no statistical confidence claim."
    },
    {
      "id": "charge-ledger",
      "observable": "charge-ledger",
      "pass_if": "Maximum charge-plus-sink relative residual <1% on every 100-period trace.",
      "fail_if": "Finite, resolved data violates the preregistered inequality.",
      "unresolved_if": "Missing, nonfinite or under-resolved signal/marker or required control.",
      "uncertainty": "Direct independent mesh, time, box differences; finite sampling; no statistical confidence claim."
    }
  ],
  "visualization_plan": [
    {
      "figure_id": "local-ticks",
      "question": "Does the same local radius keep ticking over 100 periods on each grid?",
      "role": "evidentiary",
      "observables": [
        "local clock",
        "mode energy",
        "control residuals"
      ],
      "representation": "PNG/SVG/PDF and exact CSV",
      "competing_signatures": {
        "usable": "matched prediction, parity, scaling and persistent ticks",
        "inadequate": "resolved failure or missing ticks"
      },
      "controls": [
        "frozen",
        "numerics"
      ],
      "uncertainty": "Independent numerical controls; spherical restriction",
      "source_data": [
        "plot-data/summary.json",
        "plot-data/traces.csv"
      ],
      "transformations": [
        "Saved local samples; matched no-pulse subtraction; explicitly labeled amplitude normalization; no smoothing."
      ],
      "required": true
    },
    {
      "figure_id": "long-baseline",
      "question": "Do mode energy and charge remain controlled for the full refined baseline?",
      "role": "evidentiary",
      "observables": [
        "local clock",
        "mode energy",
        "control residuals"
      ],
      "representation": "PNG/SVG/PDF and exact CSV",
      "competing_signatures": {
        "usable": "matched prediction, parity, scaling and persistent ticks",
        "inadequate": "resolved failure or missing ticks"
      },
      "controls": [
        "frozen",
        "numerics"
      ],
      "uncertainty": "Independent numerical controls; spherical restriction",
      "source_data": [
        "plot-data/summary.json",
        "plot-data/traces.csv"
      ],
      "transformations": [
        "Saved local samples; matched no-pulse subtraction; explicitly labeled amplitude normalization; no smoothing."
      ],
      "required": true
    }
  ],
  "resources": {
    "max_wall_seconds": 1800,
    "max_memory_mb": 1024,
    "max_output_mb": 100
  },
  "prohibited_inferences": [
    "No emergent spacetime, gravity, protected knot or nonspherical stability claim.",
    "Concentric counterpropagating shells are not opposing beams or a recoil calculation.",
    "This ideal local field readout is not a fully invariant two-object Test 7/9 protocol."
  ],
  "locked_sha256": "210c2b2b5f6e9fcc0b749cb20cb2d2d3cb2543bf090b5e2445ba22fcdf72a854"
}
